criterion,status,evidence,source_id,source_authority,source_url,source_retrieved_at,source_sha256,review_mode
official_national_statistics_portal_acquired,NOT_FOUND,The official BBS dissemination portal was acquired.,BGD_BBS_NSDS_PORTAL,Bangladesh Bureau of Statistics,https://nsds.bbs.gov.bd/,,,STRUCTURAL_MARKER_VALIDATION
national_accounts_release_family_identified,NOT_FOUND,The official release calendar identifies national-accounts publications.,BGD_BBS_RELEASE_CALENDAR_NATIONAL_ACCOUNTS,Bangladesh Bureau of Statistics,https://nsds.bbs.gov.bd/en/release-calendar,,,STRUCTURAL_MARKER_VALIDATION
twelve_armilar_purposes_available_in_national_accounts,NOT_FOUND,The reviewed portal evidence remains aggregate and does not expose twelve-purpose household expenditure.,BGD_BBS_NSDS_PORTAL,Bangladesh Bureau of Statistics,https://nsds.bbs.gov.bd/,,,STRUCTURAL_MARKER_VALIDATION
hies_is_national_accounts_s14_p31,NOT_FOUND,HIES is explicitly a household survey rather than national-accounts S14/P31.,BGD_BBS_HIES_DOCUMENTATION,Bangladesh Bureau of Statistics,https://nsds.bbs.gov.bd/en/posts/85/Survey%20documentation%20for%20the%20Household%20Income%20and%20Expenditure%20Survey,,,STRUCTURAL_MARKER_VALIDATION
hies_reference_period_matches_2021,NOT_FOUND,The located final HIES report refers to 2022 rather than 2021.,BGD_BBS_HIES_2022_FINAL_REPORT_PAGE,Bangladesh Bureau of Statistics,https://nsds.bbs.gov.bd/en/posts/161/Final%20Report%20of%20Household%20Income%20and%20Expenditure%20Survey%20%28HIES%29%202016,,,STRUCTURAL_MARKER_VALIDATION
exact_armilar_source_available,NOT_FOUND,"No reviewed BBS source combines 2021, current prices, strict household national accounts and twelve-purpose coverage.",BGD_BBS_NSDS_PORTAL,Bangladesh Bureau of Statistics,https://nsds.bbs.gov.bd/,,,CROSS_SOURCE_METHOD_GATE
