criterion,status,evidence,source_id,source_authority,source_url,source_retrieved_at,source_sha256,review_mode
official_grouped_hfce_publication_available,NOT_FOUND,BPS publishes GDP by expenditure with grouped household-consumption categories.,IDN_BPS_GDP_EXPENDITURE_2020_2024,Badan Pusat Statistik,https://www.bps.go.id/en/publication/2025/05/28/2a1c585ebbd574dd91afed67/gross-domestic-product-of-indonesia-by-expenditure--2020-2024.html,,,STRUCTURAL_MARKER_VALIDATION
twelve_armilar_purposes_available,NOT_FOUND,The reviewed publication is grouped and cannot be split into twelve purposes without allocation.,IDN_BPS_GDP_EXPENDITURE_2020_2024,Badan Pusat Statistik,https://www.bps.go.id/en/publication/2025/05/28/2a1c585ebbd574dd91afed67/gross-domestic-product-of-indonesia-by-expenditure--2020-2024.html,,,STRUCTURAL_MARKER_VALIDATION
sut_is_exact_purpose_source,NOT_FOUND,The SUT family is product-based and does not prove an exact COICOP-purpose table.,IDN_BPS_SUPPLY_USE_TABLES,Badan Pusat Statistik,https://www.bps.go.id/en/publication?keyword=supply%20use%20table,,,STRUCTURAL_MARKER_VALIDATION
input_output_is_exact_purpose_source,NOT_FOUND,Input-output tables are product-based and require prohibited allocation.,IDN_BPS_INPUT_OUTPUT_TABLES,Badan Pusat Statistik,https://www.bps.go.id/en/publication?keyword=input%20output%20table,,,STRUCTURAL_MARKER_VALIDATION
survey_or_cpi_can_supply_exact_weights,NOT_FOUND,Survey or CPI data remains Class C and cannot supply exact national-accounts weights.,IDN_BPS_SURVEY_OR_CPI_CLASS_C,Badan Pusat Statistik,https://www.bps.go.id/en/statistics-table?subject=3,,,STRUCTURAL_MARKER_VALIDATION
exact_armilar_source_available,NOT_FOUND,No reviewed source supplies strict S14/P31DC current-price 2021 values across twelve purposes without allocation.,IDN_BPS_GDP_EXPENDITURE_2020_2024,Badan Pusat Statistik,https://www.bps.go.id/en/publication/2025/05/28/2a1c585ebbd574dd91afed67/gross-domestic-product-of-indonesia-by-expenditure--2020-2024.html,,,CROSS_SOURCE_METHOD_GATE
